{
  "manager_id": "mgr_1",
  "bank": 0.5,
  "team_value": 100.5,
  "observed_at": "2026-07-21T12:00:00Z",
  "available_at": "2026-07-21T12:00:00Z",
  "provenance": {
    "source_ids": [
      "fpl-official-endpoints"
    ],
    "transformation_version": "0.1.0",
    "ruleset_id": "2026-27-v0.1"
  }
}
